id,c_reg,c_raj,name,name_raj,c_sti
data_ti_sprsti_189,5,66,МАРIУПОЛЬСЬКА ОДПI (КУЙБИШЕВСЬКИЙ Р-Н М.ДОНЕЦЬК),КУЙБИШЕВСЬКИЙ Р-Н М.ДОНЕЦЬК,566
data_ti_sprsti_190,5,67,МАРIУПОЛЬСЬКА ОДПI (ЛЕНIНСЬКИЙ Р-Н М.ДОНЕЦЬК),ЛЕНIНСЬКИЙ Р-Н М.ДОНЕЦЬК,567
data_ti_sprsti_191,5,68,МАРIУПОЛЬСЬКА ОДПI (ПЕТРОВСЬКИЙ Р-Н М.ДОНЕЦЬК),ПЕТРОВСЬКИЙ Р-Н М.ДОНЕЦЬК,568
data_ti_sprsti_192,5,69,МАРIУПОЛЬСЬКА ОДПI (ПРОЛЕТАРСЬКИЙ Р-Н М.ДОНЕЦЬК),ПРОЛЕТАРСЬКИЙ Р-Н М.ДОНЕЦЬК,569
data_ti_sprsti_193,5,71,БАХМУТСЬКА ОДПI ГУ ДФС У ДОН.О.(ЦЕНТР-МIСЬК.Р.ГОРЛIВК),ЦЕНТРАЛЬНО-МIСЬКИЙ Р-Н М.ГОРЛIВКА,571
data_ti_sprsti_194,5,72,БАХМУТСЬКА ОДПI ГУ ДФС У ДОН.О.(КАЛIНIН.Р-Н М.ГОРЛIВК),КАЛIНIНСЬКИЙ Р-Н М.ГОРЛIВКА,572
data_ti_sprsti_195,5,73,БАХМУТСЬКА ОДПI ГУ ДФС У ДОН.О.(МИКИТIВ.Р-Н М.ГОРЛIВК),МИКИТОВСЬКИЙ Р-Н М.ГОРЛIВКА,573
data_ti_sprsti_196,5,81,МАРIУПОЛЬСЬКА ОДПI ГУ ДФС У ДОН.ОБЛ(ЦЕНТРАЛЬНЕ ВIД-НЯ),ЦЕНТРАЛЬНИЙ Р-Н М.МАРIУПОЛЬ,581
data_ti_sprsti_197,5,82,МАРIУПОЛЬСЬКА ОДПI ГУ ДФС У ДОН.ОБЛ(КАЛЬМIУСЬКЕ ВIД-НЯ,КАЛЬМIУСЬКИЙ Р-Н М.МАРIУПОЛЬ,582
data_ti_sprsti_198,5,83,МАРIУПОЛЬСЬКА ОДПI ГУ ДФС У ДОН.ОБЛ(ЛIВОБЕРЕЖНЕ ВIД-НЯ,ЛIВОБЕРЕЖНИЙ Р-Н М.МАРIУПОЛЬ,583
data_ti_sprsti_199,5,84,МАРIУПОЛЬСЬКА ОДПI ГУ ДФС У ДОН.ОБЛ(ПРИМОРСЬКЕ ВIД-НЯ),ПРИМОРСЬКИЙ Р-Н М.МАРIУПОЛЬ,584
data_ti_sprsti_200,5,91,ПОКРОВСЬКА ОДПI (ЦЕНТРАЛЬНО-МIСЬКИЙ Р-Н М. МАКIЇВКА),ЦЕНТРАЛЬНО-МIСЬКИЙ Р-Н М.МАКIЇВКА,591
data_ti_sprsti_201,5,92,ПОКРОВСЬКА ОДПI (ЧЕРВОНОГВАРДIЙСЬКИЙ Р-Н М. МАКIЇВКА,ЧЕРВОНОГВАРДIЙСЬКИЙ Р-Н М.МАКIЇВКА,592
data_ti_sprsti_202,5,93,ПОКРОВСЬКА ОДПI (КIРОВСЬКИЙ Р-Н М. МАКIЇВКА),КIРОВСЬКИЙ Р-Н М.МАКIЇВКА,593
data_ti_sprsti_203,5,94,ПОКРОВСЬКА ОДПI (СОВЄТСЬКИЙ Р-Н М. МАКIЇВКА),СОВЄТСЬКИЙ Р-Н М.МАКIЇВКА,594
data_ti_sprsti_204,5,95,ПОКРОВСЬКА ОДПI (ГIРНИЦЬКИЙ Р-Н М. МАКIЇВКА),ГIРНИЦЬКИЙ Р-Н М.МАКIЇВКА,595
data_ti_sprsti_205,6,1,АНДРУШIВСЬКЕ ВIДДIЛЕННЯ БЕРДИЧIВСЬКОЇ ОДПI,АНДРУШIВСЬКИЙ Р-Н,601
data_ti_sprsti_206,6,2,БАРАНIВСЬКЕ ВIДДIЛЕННЯ НОВОГРАД-ВОЛИНСЬКОЇ ОДПI,БАРАНIВСЬКИЙ Р-Н,602
data_ti_sprsti_207,6,3,БЕРДИЧIВСЬКА ОБ'ЄДНАНА ДПI,БЕРДИЧIВСЬКИЙ Р-Н,603
data_ti_sprsti_208,6,4,БРУСИЛIВСЬКЕ ВIДДIЛЕННЯ ЖИТОМИРСЬКОЇ ОДПI,БРУСИЛIВСЬКИЙ Р-Н,604
data_ti_sprsti_209,6,5,ХОРОШIВСЬКЕ ВIДДIЛЕННЯ КОРОСТЕНСЬКОЇ ОДПI,ХОРОШIВСЬКИЙ Р-Н,605
data_ti_sprsti_210,6,6,РОМАНIВСЬКЕ ВIДДIЛЕННЯ НОВОГРАД-ВОЛИНСЬКОЇ ОДПI,РОМАНIВСЬКИЙ Р-Н,606
data_ti_sprsti_211,6,7,ЄМIЛЬЧИНСЬКЕ ВIДДIЛЕННЯ НОВОГРАД-ВОЛИНСЬКОЇ ОДПI,ЄМIЛЬЧИНСЬКИЙ Р-Н,607
data_ti_sprsti_212,6,8,ЖИТОМИРСЬКА ОБ'ЄДНАНА ДПI (ЖИТОМИРСЬКИЙ РАЙОН),ЖИТОМИРСЬКИЙ Р-Н,608
data_ti_sprsti_213,6,9,КОРОСТЕНСЬКА ОБ'ЄДНАНА ДПI,КОРОСТЕНСЬКИЙ Р-Н,609
data_ti_sprsti_214,6,10,КОРОСТИШIВСЬКЕ ВIДДIЛЕННЯ ЖИТОМИРСЬКОЇ ОДПI,КОРОСТИШIВСЬКИЙ Р-Н,610
data_ti_sprsti_215,6,11,ЛУГИНСЬКЕ ВIДДIЛЕННЯ КОРОСТЕНСЬКОЇ ОДПI,ЛУГИНСЬКИЙ Р-Н,611
data_ti_sprsti_216,6,12,ЛЮБАРСЬКЕ ВIДДIЛЕННЯ БЕРДИЧIВСЬКОЇ ОДПI,ЛЮБАРСЬКИЙ Р-Н,612
data_ti_sprsti_217,6,13,МАЛИНСЬКА ОБ'ЄДНАНА ДПI,МАЛИНСЬКИЙ Р-Н,613
data_ti_sprsti_218,6,14,НАРОДИЦЬКЕ ВIДДIЛЕННЯ ОВРУЦЬКОЇ ОДПI,НАРОДИЦЬКИЙ Р-Н,614
data_ti_sprsti_219,6,15,НОВОГРАД-ВОЛИНСЬКА ОБ'ЄДНАНА ДПI ГУ ДФС,НОВОГРАД-ВОЛИНСЬКИЙ Р-Н,615
data_ti_sprsti_220,6,16,ОВРУЦЬКА ОБ'ЄДНАНА ДПI,ОВРУЦЬКИЙ Р-Н,616
data_ti_sprsti_221,6,17,ОЛЕВСЬКЕ ВIДДIЛЕННЯ КОРОСТЕНСЬКОЇ ОДПI,ОЛЕВСЬКИЙ Р-Н,617
data_ti_sprsti_222,6,18,ПОПIЛЬНЯНСЬКЕ ВIДДIЛЕННЯ БЕРДИЧIВСЬКОЇ ОДПI,ПОПIЛЬНЯНСЬКИЙ Р-Н,618
data_ti_sprsti_223,6,19,РАДОМИШЛЬСЬКЕ ВIДДIЛЕННЯ МАЛИНСЬКОЇ ОДПI,РАДОМИШЛЬСЬКИЙ Р-Н,619
data_ti_sprsti_224,6,20,РУЖИНСЬКЕ ВIДДIЛЕННЯ БЕРДИЧIВСЬКОЇ ОДПI,РУЖИНСЬКИЙ Р-Н,620
data_ti_sprsti_225,6,21,ПУЛИНСЬКЕ ВIДДIЛЕННЯ КОРОСТЕНСЬКОЇ ОДПI,ПУЛИНСЬКИЙ Р-Н,621
data_ti_sprsti_226,6,22,ЧЕРНЯХIВСЬКЕ ВIДДIЛЕННЯ КОРОСТЕНСЬКОЇ ОДПI,ЧЕРНЯХIВСЬКИЙ Р-Н,622
data_ti_sprsti_227,6,23,ЧУДНIВСЬКЕ ВIДДIЛЕННЯ БЕРДИЧIВСЬКОЇ ОДПI,ЧУДНIВСЬКИЙ Р-Н,623
data_ti_sprsti_228,6,24,БЕРДИЧIВСЬКА ОБ'ЄДНАНА ДПI (М.БЕРДИЧIВ),М.БЕРДИЧIВ,624
data_ti_sprsti_229,6,25,ЖИТОМИРСЬКА ОБ'ЄДНАНА ДПI ГУ ДФС У ЖИТОМИРСЬКIЙ ОБЛ.,М.ЖИТОМИР,625
data_ti_sprsti_230,6,26,КОРОСТЕНСЬКА ОБ'ЄДНАНА ДПI (М.КОРОСТЕНЬ),М.КОРОСТЕНЬ,626
data_ti_sprsti_231,6,27,НОВОГРАД-ВОЛИНСЬКА ОБ'ЄДНАНА ДПI (М.НОВОГРАД-ВОЛ),М.НОВОГРАД-ВОЛИНСЬКИЙ,627
data_ti_sprsti_232,6,28,ДПI У М. ЖИТОМИР,БОГУНСЬКИЙ Р-Н М.ЖИТОМИР,628
data_ti_sprsti_233,6,29,ДПI У М. ЖИТОМИР,КОРОЛЬОВСЬКИЙ Р-Н М.ЖИТОМИР,629
data_ti_sprsti_234,6,50,МАЛИНСЬКА ОБ'ЄДНАНА ДПI  (М.МАЛИН),М.МАЛИН,650
data_ti_sprsti_235,7,1,УЖГОРОДСЬКА ОДПI ГУ ДФС У ЗАК.ОБЛ.(ВIД-НЯ У М.УЖГОРОД),М.УЖГОРОД,701
data_ti_sprsti_236,7,2,МУКАЧIВСЬКА ОДПI ГУ ДФС У ЗАКАРПАТСЬК ОБЛ.(М.МУКАЧЕВО),М.МУКАЧЕВО,702
data_ti_sprsti_237,7,3,ВИНОГРАДIВСЬКА ОДПI ГУ ДФС У ЗАК.ОБЛ.(БЕРЕГIВСЬКИЙ Р-Н,БЕРЕГIВСЬКИЙ Р-Н,703
data_ti_sprsti_238,7,4,УЖГОРОДСЬКА ОДПI ГУ ДФС (ВЕЛИКОБЕРЕЗНЯНСЬКЕ ВIД-НЯ),ВЕЛИКОБЕРЕЗНЯНСЬКИЙ Р-Н,704
data_ti_sprsti_239,7,5,ВИНОГРАДIВСЬКА ОДПI ГУ ДФС У ЗАКАРПАТСЬКIЙ ОБЛ,ВИНОГРАДIВСЬКИЙ Р-Н,705
data_ti_sprsti_240,7,6,МУКАЧIВСЬКА ОДПI ГУ ДФС У ЗАК.ОБЛ.(ВОЛОВЕЦЬКЕ ВIД-НЯ),ВОЛОВЕЦЬКИЙ Р-Н,706
data_ti_sprsti_241,7,7,ХУСТСЬКА ОДПI ГУ ДФС У ЗАК.ОБЛ. (IРШАВСЬКЕ ВIД-НЯ),IРШАВСЬКИЙ Р-Н,707
data_ti_sprsti_242,7,8,ХУСТСЬКА ОДПI ГУ ДФС У ЗАК.ОБЛ. (МIЖГIРСЬКЕ ВIД-НЯ),МIЖГIРСЬКИЙ Р-Н,708
data_ti_sprsti_243,7,9,МУКАЧIВСЬКА ОДПI ГУ ДФС У ЗАКАРПАТСЬКIЙ ОБЛАСТI,МУКАЧIВСЬКИЙ Р-Н,709
data_ti_sprsti_244,7,10,УЖГОРОДСЬКА ОДПI ГУ ДФС У ЗАК.ОБЛ.(ПЕРЕЧИНСЬКЕ ВIД-НЯ),ПЕРЕЧИНСЬКИЙ Р-Н,710
data_ti_sprsti_245,7,11,ДПI У РАХIВСЬКОМУ Р-НI ГУ ДФС У ЗАКАРПАТСЬКIЙ ОБЛАСТI,РАХIВСЬКИЙ Р-Н,711
data_ti_sprsti_246,7,12,МУКАЧIВСЬКА ОДПI ГУ ДФС У ЗАК.ОБЛ. (СВАЛЯВСКЕ ВIД-НЯ),СВАЛЯВСЬКИЙ Р-Н,712
data_ti_sprsti_247,7,13,ДПI У ТЯЧIВСЬКОМУ Р-НI ГУ ДФС У ЗАКАРПАТСЬКIЙ ОБЛАСТI,ТЯЧIВСЬКИЙ Р-Н,713
data_ti_sprsti_248,7,14,УЖГОРОДСЬКА ОДПI ГУ ДФС У ЗАКАРПАТСЬКIЙ ОБЛАСТI,УЖГОРОДСЬКИЙ Р-Н,714
data_ti_sprsti_249,7,15,ХУСТСЬКА ОДПI ГУ ДФС У ЗАКАРПАТСЬКIЙ ОБЛАСТI,ХУСТСЬКИЙ Р-Н,715
data_ti_sprsti_250,7,17,ХУСТСЬКА ОДПI ГУ ДФС У ЗАКАРПАТСЬКIЙ ОБЛ. (М.ХУСТ),М.ХУСТ,717
data_ti_sprsti_251,7,18,ВИНОГРАДIВСЬКА ОДПI ГУ ДФС У ЗАК.ОБЛ. (М.БЕРЕГОВО),М.БЕРЕГОВО,718
data_ti_sprsti_252,7,51,УЖГОРОДСЬКА ОДПI ГУ ДФС У ЗАКАРПАТСЬКIЙ ОБЛАСТI(М.ЧОП),М.ЧОП,751
data_ti_sprsti_253,8,2,БЕРДЯНСЬКА ОДПI ГУ ДФС У ЗАПОРIЗЬКIЙ ОБЛ.,БЕРДЯНСЬКИЙ РАЙОН,802
data_ti_sprsti_254,8,3,ТОКМАЦЬКА ОДПI ГУ ДФС (ВАСИЛIВСЬКЕ ВIД-НЯ),ВАСИЛIВСЬКИЙ РАЙОН,803
data_ti_sprsti_255,8,4,ЕНЕРГОДАРСЬКА ОДПI ГУ ДФС (ВЕЛИКОБIЛОЗЕРСЬКЕ ВIД-НЯ),ВЕЛИКОБIЛОЗЕРСЬКИЙ РАЙОН,804
data_ti_sprsti_256,8,5,МЕЛIТОПОЛЬСЬКА ОДПI ГУ ДФС (ВЕСЕЛIВСЬКЕ ВIД-НЯ),ВЕСЕЛIВСЬКИЙ РАЙОН,805
data_ti_sprsti_257,8,6,ВIЛЬНЯНСЬКА OДПI ГУ ДФС (ВIЛЬНЯНСЬКЕ ВIД-НЯ),ВIЛЬНЯНСЬКИЙ РАЙОН,806
data_ti_sprsti_258,8,7,ПОЛОГIВСЬКА ОДПI ГУ ДФС (ГУЛЯЙПIЛЬСЬКЕ ВIД-НЯ),ГУЛЯЙПIЛЬСЬКИЙ РАЙОН,807
data_ti_sprsti_259,8,8,ВIЛЬНЯНСЬКА OДПI ГУ ДФС У ЗАПОРIЗЬКIЙ ОБЛ.,ЗАПОРIЗЬКИЙ РАЙОН,808
data_ti_sprsti_260,8,9,ЕНЕРГОДАРСЬКА ОДПI ГУ ДФС (КАМ'ЯНСЬКО-ДНIПРОВСЬКЕ ВIД),КАМ'ЯНСЬКО-ДНIПРОВСЬКИЙ РАЙОН,809
data_ti_sprsti_261,8,10,ПОЛОГIВСЬКА ОДПI ГУ ДФС (БIЛЬМАЦЬКЕ ВIД-НЯ),БIЛЬМАЦЬКИЙ РАЙОН,810
data_ti_sprsti_262,8,11,МЕЛIТОПОЛЬСЬКА ОДПI ГУ ДФС У ЗАПОРIЗЬКIЙ ОБЛ.,МЕЛIТОПОЛЬСЬКИЙ РАЙОН,811
data_ti_sprsti_263,8,12,ТОКМАЦЬКА ОДПI ГУ ДФС (МИХАЙЛIВСЬКЕ ВIД-НЯ),МИХАЙЛIВСЬКИЙ РАЙОН,812
data_ti_sprsti_264,8,13,ВIЛЬНЯНСЬКА OДПI ГУ ДФС (НОВОМИКОЛАЇВСЬКЕ ВIД-НЯ),НОВОМИКОЛАЇВСЬКИЙ РАЙОН,813
data_ti_sprsti_265,8,14,ПОЛОГIВСЬКА ОДПI ГУ ДФС (ОРIХIВСЬКЕ ВIД-НЯ),ОРIХIВСЬКИЙ РАЙОН,814
data_ti_sprsti_266,8,15,ПОЛОГIВСЬКА ОДПI ГУ ДФС У ЗАПОРIЗЬКIЙ ОБЛ.,ПОЛОГIВСЬКИЙ РАЙОН,815
data_ti_sprsti_267,8,16,МЕЛIТОПОЛЬСЬКА ОДПI ГУ ДФС (ПРИАЗОВСЬКЕ ВIД-НЯ),ПРИАЗОВСЬКИЙ РАЙОН,816
data_ti_sprsti_268,8,17,БЕРДЯНСЬКА ОДПI ГУ ДФС (ПРИМОРСЬКЕ ВIД-НЯ),ПРИМОРСЬКИЙ РАЙОН,817
data_ti_sprsti_269,8,18,ПОЛОГIВСЬКА ОДПI ГУ ДФС (РОЗIВСЬКЕ ВIД-НЯ),РОЗIВСЬКИЙ РАЙОН,818
data_ti_sprsti_270,8,19,ТОКМАЦЬКА ОДПI ГУ ДФС У ЗАПОРIЗЬКIЙ ОБЛ.,ТОКМАЦЬКИЙ РАЙОН,819
data_ti_sprsti_271,8,20,ТОКМАЦЬКА ОДПI ГУ ДФС (ЧЕРНIГIВСЬКЕ ВIД-НЯ),ЧЕРНIГIВСЬКИЙ РАЙОН,820
data_ti_sprsti_272,8,21,МЕЛIТОПОЛЬСЬКА ОДПI ГУ ДФС (ЯКИМIВСЬКЕ ВIД-НЯ),ЯКИМIВСЬКИЙ РАЙОН,821
data_ti_sprsti_273,8,22,БЕРДЯНСЬКА ОДПI ГУ ДФС У ЗАПОРIЗЬКIЙ ОБЛ.,М. БЕРДЯНСЬК,822
data_ti_sprsti_274,8,23,ЕНЕРГОДАРСЬКА ОДПI ГУ ДФС У ЗАПОРIЗЬКIЙ ОБЛ.,М.ЕНЕРГОДАР,823
data_ti_sprsti_275,8,24,СДПI ПО РОБОТI З ВПП У М.ЗАПОРIЖЖI  ДПС,М.ЗАПОРIЖЖЯ,824
data_ti_sprsti_276,8,25,ЗАПОРIЗЬКА ОДПI ГУ ДФС (ВIД-НЯ У ЗАВОДСЬКОМУ Р-НI М.ЗА,ЗАВОДСЬКИЙ Р-Н М.ЗАПОРIЖЖЯ,825
data_ti_sprsti_277,8,26,ЗАПОРIЗЬКА ОДПI ГУ ДФС (ВIД-НЯ В ОЛЕКСАНДРIВСЬКОМУ Р-Н,ОЛЕКСАНДРIВСЬКИЙ РАЙОН М.ЗАПОРIЖЖЯ,826
data_ti_sprsti_278,8,27,ЗАПОРIЗЬКА ОДПI ГУ ДФС (ВIД-НЯ У КОМУНАРСЬКОМУ Р-НI М.,КОМУНАРСЬКИЙ РАЙОН М.ЗАПОРIЖЖЯ,827
data_ti_sprsti_279,8,28,ЗАПОРIЗЬКА ОДПI ГУ ДФС (ВIД-НЯ У ДНIПРОВСЬКОМУ Р-НI М.,ДНIПРОВСЬКИЙ РАЙОН М.ЗАПОРIЖЖЯ,828
data_ti_sprsti_280,8,29,ЗАПОРIЗЬКА ОДПI ГУ ДФС У ЗАПОРIЗЬКIЙ ОБЛАСТI,ВОЗНЕСЕНIВСЬКИЙ РАЙОН М.ЗАПОРIЖЖЯ,829
data_ti_sprsti_281,8,30,ЗАПОРIЗЬКА ОДПI ГУ ДФС (ВIД-НЯ У ШЕВЧЕНКIВСЬКОМУ Р-НI,ШЕВЧЕНКIВСЬКИЙ РАЙОН М.ЗАПОРIЖЖЯ,830
data_ti_sprsti_282,8,31,ЗАПОРIЗЬКА ОДПI ГУ ДФС (ВIД-НЯ У ХОРТИЦЬКОМУ Р-НI М.ЗА,ХОРТИЦЬКИЙ РАЙОН М.ЗАПОРIЖЖЯ,831
data_ti_sprsti_283,8,32,МЕЛIТОПОЛЬСЬКА ОДПI ГУ ДФС У ЗАПОРIЗЬКIЙ ОБЛ.,М.МЕЛIТОПОЛЬ,832
data_ti_sprsti_284,8,33,ТОКМАЦЬКА ОДПI ГУ ДФС У ЗАПОРIЗЬКIЙ ОБЛ.,М.ТОКМАК,833
data_ti_sprsti_285,9,1,НАДВIРНЯНСЬКА ОДПI ГУ ДФС (БОГОРОДЧАНСЬКЕ ВIДДIЛЕННЯ),БОГОРОДЧАНСЬКИЙ Р-Н,901
data_ti_sprsti_286,9,2,КОЛОМИЙСЬКА ОДПI ГУ ДФС (ВЕРХОВИНСЬКЕ ВIДДIЛЕННЯ),ВЕРХОВИНСЬКИЙ Р-Н,902
data_ti_sprsti_287,9,3,КАЛУСЬКА ОДПI ГУ ДФС (ГАЛИЦЬКЕ ВIДДIЛЕННЯ),ГАЛИЦЬКИЙ Р-Н,903
data_ti_sprsti_288,9,4,ТИСМЕНИЦЬКА ОДПI ГУ ДФС(ГОРОДЕНКIВСЬКЕ ВIДДIЛЕННЯ),ГОРОДЕНКIВСЬКИЙ Р-Н,904
data_ti_sprsti_289,9,5,ДОЛИНСЬКА ОДПI ГУ ДФС,ДОЛИНСЬКИЙ Р-Н,905
data_ti_sprsti_290,9,6,КАЛУСЬКА ОДПI ГУ ДФС,КАЛУСЬКИЙ Р-Н,906
data_ti_sprsti_291,9,7,КОЛОМИЙСЬКА ОДПI ГУ ДФС,КОЛОМИЙСЬКИЙ Р-Н,907
data_ti_sprsti_292,9,8,КОЛОМИЙСЬКА ОДПI ГУ ДФС (КОСIВСЬКЕ ВIДДIЛЕННЯ),КОСIВСЬКИЙ Р-Н,908
data_ti_sprsti_293,9,9,НАДВIРНЯНСЬКА ОДПI ГУ ДФС,НАДВIРНЯНСЬКИЙ Р-Н,909
data_ti_sprsti_294,9,10,КАЛУСЬКА ОДПI ГУ ДФС (РОГАТИНСЬКЕ ВIДДIЛЕННЯ),РОГАТИНСЬКИЙ Р-Н,910
data_ti_sprsti_295,9,11,ДОЛИНСЬКА ОДПI ГУ ДФС (РОЖНЯТIВСЬКЕ ВIДДIЛЕННЯ),РОЖНЯТIВСЬКИЙ Р-Н,911
data_ti_sprsti_296,9,12,КОЛОМИЙСЬКА ОДПI ГУ ДФС (СНЯТИНСЬКЕ ВIДДIЛЕННЯ),СНЯТИНСЬКИЙ Р-Н,912
data_ti_sprsti_297,9,13,ТИСМЕНИЦЬКА ОДПI ГУ ДФС,ТИСМЕНИЦЬКИЙ Р-Н,913
data_ti_sprsti_298,9,14,ТИСМЕНИЦЬКА ОДПI ГУ ДФС (ТЛУМАЦЬКЕ ВIДДIЛЕННЯ),ТЛУМАЦЬКИЙ Р-Н,914
data_ti_sprsti_299,9,15,ДПI У М.IВАНО-ФРАНКIВСЬКУ ГУ ДФС,М.IВАНО-ФРАНКIВСЬК,915
data_ti_sprsti_300,9,16,КАЛУСЬКА ОДПI ГУ ДФС,М.КАЛУШ,916
data_ti_sprsti_301,9,17,КОЛОМИЙСЬКА ОДПI ГУ ДФС,М.КОЛОМИЯ,917
data_ti_sprsti_302,9,18,НАДВIРНЯНСЬКА ОДПI ГУ ДФС (ЯРЕМЧАНСЬКЕ ВIДДIЛЕННЯ),М.ЯРЕМЧЕ,918
data_ti_sprsti_303,9,20,ДОЛИНСЬКА ОДПI ГУ ДФС (БОЛЕХIВСЬКЕ ВIДДIЛЕННЯ),М.БОЛЕХIВ,920
data_ti_sprsti_304,9,21,КАЛУСЬКА ОДПI ГУ ДФС (ГАЛИЦЬКЕ ВIДДIЛЕННЯ),М.БУРШТИН,921
data_ti_sprsti_305,10,1,БАРИШIВСЬКО-БЕРЕЗАНСЬКЕ ВIДДIЛЕННЯ (БАРИШIВСЬКИЙ Р-Н),БАРИШIВСЬКИЙ Р-Н,1001
data_ti_sprsti_306,10,2,БIЛОЦЕРКIВСЬКА ОДПI ГУ ДФС У КИЇВСЬКIЙ ОБЛАСТI,БIЛОЦЕРКIВСЬКИЙ РАЙОН,1002
data_ti_sprsti_307,10,3,БОГУСЛАВСЬКЕ ВIДДIЛЕННЯ БIЛОЦЕРКIВСЬКОЇ ОДПI,БОГУСЛАВСЬКИЙ Р-Н,1003
data_ti_sprsti_308,10,4,"БОРИСПIЛЬСЬКЕ ВIДДIЛЕН, (БОРИСП. Р-Н.)БРОВАРСЬКОЇ ОДПI",БОРИСПIЛЬСЬКИЙ РАЙОН,1004
data_ti_sprsti_309,10,5,ВИШГОРОДСЬКА ОДПI БОРОДЯНСЬКЕ ВIДДIЛЕННЯ,СМТ. БОРОДЯНКА,1005
data_ti_sprsti_310,10,6,БРОВАРСЬКА ОДПI (БРОВАРСЬКИЙ Р-Н) ГУ ДФС У КИЇВСЬКIЙ,БРОВАРСЬКИЙ РАЙОН,1006
data_ti_sprsti_311,10,7,КИЕВО-СВЯТОШИНСЬКА ОДПI (ВАСИЛЬКIВСЬКЕ ВIДДIЛЕННЯ),ВАСИЛЬКIВСЬКИЙ Р-Н,1007
data_ti_sprsti_312,10,8,ВИШГОРОДСЬКА ОДПI ГУ ДФС У КИЇВСЬКIЙ ОБЛАСТI,ВИШГОРОДСЬКИЙ РАЙОН,1008
data_ti_sprsti_313,10,9,ВОЛОДАРСЬКЕ ВIДДIЛЕННЯ БIЛОЦЕРКIВСЬКОЇ ОДПI,ВОЛОДАРСЬКИЙ Р-Н,1009
data_ti_sprsti_314,10,10,ЗГУРIВСЬКЕ ВIДДIЛЕННЯ БРОВАРСЬКОЇ ОДПI,ЗГУРIВСЬКИЙ Р-Н,1010
data_ti_sprsti_315,10,11,ВИШГОРОДСЬКА ОДПI IВАНКIВСЬКЕ ВIДДIЛЕННЯ,IВАНКIВСЬКИЙ РАЙОН,1011
data_ti_sprsti_316,10,12,КАГАРЛИЦЬКЕ ВIДIЛЕННЯ БIЛОЦЕРКIВСЬКОЇ ОДПI,КАГАРЛИЦЬКИЙ Р-Н,1012
data_ti_sprsti_317,10,13,КИЕВО-СВЯТОШИНСЬКА ОДПI ГУ ДФС У КИЇВСЬКIЙ ОБЛАСТI,КИЄВО-СВЯТОШИНСЬКИЙ Р-Н,1013
data_ti_sprsti_318,10,14,ВИШГОРОДСЬКА ОДПI МАКАРIВСЬКЕ ВIДДIЛЕННЯ,МАКАРIВСЬКИЙ Р-Н,1014
data_ti_sprsti_319,10,15,МИРОНIВСЬКЕ ВIДДIЛЕННЯ БIЛОЦЕРКIВСЬКОЇ ОДПI,МИРОНIВСЬКИЙ Р-Н,1015
data_ti_sprsti_320,10,16,КИЕВО-СВЯТОШИНСЬКА ОДПI (ОБУХIВСЬКЕ ВIДДIЛЕННЯ),ОБУХIВСЬКИЙ Р-Н,1016
data_ti_sprsti_321,10,17,ПЕРЕЯСЛАВ-ХМЕЛЬНИЦЬКЕ ВIД (ПЕРЕЯСЛ-ХМ. Р-Н) БРОВ.ОДПI,ПЕРЕЯСЛАВ-ХМЕЛЬНИЦЬКИЙ Р-Н,1017
data_ti_sprsti_322,10,18,ВИШГОРОДСЬКА ОДПI ПОЛIСЬКЕ ВIДДIЛЕННЯ,ПОЛIСЬКИЙ РАЙОН,1018
data_ti_sprsti_323,10,19,РОКИТНЯНСЬКЕ ВIДДIЛЕННЯ БIЛОЦЕРКIВСЬКОЇ ОДПI,РОКИТНЯНСЬКИЙ РАЙОН,1019
data_ti_sprsti_324,10,20,СКВИРСЬКЕ ВIДДIЛЕННЯ БIЛОЦЕРКIВСЬКОЇ ОДПI,СКВИРСЬКИЙ Р-Н,1020
data_ti_sprsti_325,10,21,СТАВИЩЕНСЬКЕ ВIДДIЛЕННЯ БIЛОЦЕРКIВСЬКОЇ ОДПI,СТАВИЩЕНСЬКИЙ Р-Н,1021
data_ti_sprsti_326,10,22,ТАРАЩАНСЬКЕ ВIДДIЛЕННЯ БIЛОЦЕРКIВСЬКОЇ ОДПI,ТАРАЩАНСЬКИЙ РАЙОН,1022
data_ti_sprsti_327,10,23,ТЕТIЇВСЬКЕ ВIДДIЛЕННЯ БIЛОЦЕРКIВСЬКОЇ ОДПI,ТЕТIЇВСЬКИЙ Р-Н,1023
data_ti_sprsti_328,10,24,КИЕВО-СВЯТОШИНСЬКА ОДПI (ФАСТIВСЬКЕ ВIДДIЛЕННЯ),ФАСТIВСЬКИЙ Р-Н,1024
data_ti_sprsti_329,10,25,ЯГОТИНСЬКЕ ВIДДIЛЕННЯ БРОВАРСЬКОЇ ОДПI,ЯГОТИНСЬКИЙ Р-Н,1025
data_ti_sprsti_330,10,26,БАРИШIВСЬКО-БЕРЕЗАНСЬКЕ ВIДДIЛЕННЯ (М.БЕРЕЗАНЬ),М.БЕРЕЗАНЬ,1026
data_ti_sprsti_331,10,27,БIЛОЦЕРКIВСЬКА ОДПI ГУ ДФС У КИЇВСЬКIЙ ОБЛАСТI,М.БIЛА ЦЕРКВА,1027
data_ti_sprsti_332,10,28,БОРИСПIЛЬСЬКЕ ВIДДIЛЕННЯ (М.БОРИСП.) БРОВАРСЬКОЇ ОДПI,М.БОРИСПIЛЬ,1028
data_ti_sprsti_333,10,29,БРОВАРСЬКА ОДПI (М.БРОВАРИ) ГУ ДФС У КИЇВСЬКIЙ ОБЛАСТI,М.БРОВАРИ,1029
data_ti_sprsti_334,10,30,КИЕВО-СВЯТОШИНСЬКА ОДПI (ВАСИЛЬКIВСЬКЕ В. М.ВАСИЛЬКIВ),М.ВАСИЛЬКIВ,1030
data_ti_sprsti_335,10,31,ВИШГОРОДСЬКА ОДПI IРПIНСЬКЕ ВIДДIЛЕННЯ,М.IРПIНЬ,1031
data_ti_sprsti_336,10,32,ПЕРЕЯСЛАВ-ХМЕЛЬНИЦЬКЕ ВIД (М.ПЕРЕЯСЛ-ХМ.) БРОВ.ОДПI,М.ПЕРЕЯСЛАВ-ХМЕЛЬНИЦЬКИЙ,1032
data_ti_sprsti_337,10,33,КАГАРЛИЦЬКЕ ВIДДIЛЕННЯ (М.РЖИЩIВ) БIЛОЦЕРКIВСЬКОЇ ОДПI,М.РЖИЩIВ,1033
data_ti_sprsti_338,10,34,ВIДДIЛЕННЯ У М СЛАВУТИЧI БРОВАРСЬКОЇ ОДПI,М.СЛАВУТИЧ,1034
data_ti_sprsti_339,10,35,КИЕВО-СВЯТОШИНСЬКА ОДПI (ФАСТIВСЬКЕ В. М.ФАСТIВ),М.ФАСТIВ,1035
data_ti_sprsti_340,10,37,КИЕВО-СВЯТОШИНСЬКА ОДПI (ОБУХIВСЬКЕ В. М.ОБУХIВ),М.ОБУХIВ,1037
data_ti_sprsti_341,10,38,ВИШГОРОДСЬКА ОДПI IРПIНСЬКЕ ВIДДIЛЕННЯ М. БУЧА,М.БУЧА,1038
data_ti_sprsti_342,10,51,УПРАВЛIННЯ ОПОДАТКУВАННЯ ОБЛАСНИХ ОРГАНIЗАЦIЙ,КИЇВСЬКА ОБЛАСТЬ,1051
data_ti_sprsti_343,11,1,НОВОУКРАЇНСЬКА ОДПI ГУ ДФС  (БОБРИНЕЦЬКЕ ВIДДIЛЕННЯ),БОБРИНЕЦЬКИЙ РАЙОН,1101
data_ti_sprsti_344,11,2,ГОЛОВАНIВСЬКА ОДПI ГУ ДФС (ВIЛЬШАНСЬКЕ ВIДДIЛЕННЯ),ВIЛЬШАНСЬКИЙ РАЙОН,1102
data_ti_sprsti_345,11,3,ГОЛОВАНIВСЬКА ОДПI ГУ ДФС (ГАЙВОРОНСЬКЕ ВIДДIЛЕННЯ),ГАЙВОРОНСЬКИЙ РАЙОН,1103
data_ti_sprsti_346,11,4,ГОЛОВАНIВСЬКА ОДПI ГУ ДФС У КIРОВОГРАДСЬКIЙ ОБЛАСТI,ГОЛОВАНIВСЬКИЙ РАЙОН,1104
data_ti_sprsti_347,11,5,ГОЛОВАНIВСЬКА ОДПI ГУ ДФС (ДОБРОВЕЛИЧКIВСЬКЕ ВIД-НЯ),ДОБРОВЕЛИЧКIВСЬКИЙ РАЙОН,1105
data_ti_sprsti_348,11,6,КРОПИВНИЦЬКА ОДПI ГУ ДФС (ДОЛИНСЬКЕ ВIДДIЛЕННЯ),ДОЛИНСЬКИЙ РАЙОН,1106
data_ti_sprsti_349,11,7,ОЛЕКСАНДРIЙСЬКА ОДПI ГУ ДФС (ЗНАМ'ЯНСЬКИЙ РАЙОН),ЗНАМ'ЯНСЬКИЙ РАЙОН,1107
data_ti_sprsti_350,11,8,КРОПИВНИЦЬКА ОДПI ГУ ДФС (КIРОВОГРАДСЬКЕ ВIДДIЛЕННЯ),КIРОВОГРАДСЬКИЙ РАЙОН,1108
data_ti_sprsti_351,11,9,НОВОУКРАЇНСЬКА ОДПI ГУ ДФС (КОМПАНIЇВСЬКЕ ВIДДIЛЕННЯ),КОМПАНIЇВСЬКИЙ РАЙОН,1109
data_ti_sprsti_352,11,10,НОВОУКРАЇНСЬКА ОДПI ГУ ДФС (МАЛОВИСКIВСЬКЕ ВIДДIЛЕННЯ),МАЛОВИСКIВСЬКИЙ РАЙОН,1110
data_ti_sprsti_353,11,11,КРОПИВНИЦЬКА ОДПI ГУ ДФС (НОВГОРОДКIВСЬКЕ ВIДДIЛЕННЯ,НОВГОРОДКIВСЬКИЙ РАЙОН,1111
data_ti_sprsti_354,11,12,ГОЛОВАНIВСЬКА ОДПI ГУ ДФС (НОВОАРХАНГЕЛЬСЬКЕ ВIД-ННЯ),НОВОАРХАНГЕЛЬСЬКИЙ РАЙОН,1112
data_ti_sprsti_355,11,13,НОВОУКРАЇНСЬКА  ОДПI ГУ ДФС (НОВОМИРГОРОДСЬКЕ ВIД-НЯ),НОВОМИРГОРОДСЬКИЙ РАЙОН,1113
data_ti_sprsti_356,11,14,НОВОУКРАЇНСЬКА  ОДПI ГУ ДФС У КIРОВОГРАДСЬКIЙ ОБЛАСТI,НОВОУКРАЇНСЬКИЙ РАЙОН,1114
data_ti_sprsti_357,11,15,ОЛЕКСАНДРIЙСЬКА ОДПI ГУ ДФС (ОЛЕКСАНДРIВСЬКЕ ВIДДIЛЕНН,ОЛЕКСАНДРIВСЬКИЙ РАЙОН,1115
data_ti_sprsti_358,11,16,ОЛЕКСАНДРIЙСЬКА ОДПI ГУ ДФС (ОЛЕКСАНДРIЙСЬКИЙ РАЙОН),ОЛЕКСАНДРIЙСЬКИЙ РАЙОН,1116
data_ti_sprsti_359,11,17,ОЛЕКСАНДРIЙСЬКА ОДПI ГУ ДФС (ОНУФРIЇВСЬКЕ ВIДДIЛЕННЯ),ОНУФРIЇВСЬКИЙ РАЙОН,1117
data_ti_sprsti_360,11,18,ОЛЕКСАНДРIЙСЬКА ОДПI ГУ ДФС (ПЕТРIВСЬКЕ ВIДДIЛЕННЯ),ПЕТРIВСЬКИЙ РАЙОН,1118
data_ti_sprsti_361,11,19,ОЛЕКСАНДРIЙСЬКА ОДПI ГУ ДФС (СВIТЛОВОДСЬКИЙ РАЙОН),СВIТЛОВОДСЬКИЙ РАЙОН,1119
data_ti_sprsti_362,11,20,ГОЛОВАНIВСЬКА ОДПI ГУ ДФС (БЛАГОВIЩЕНСЬКЕ ВIДДIЛЕННЯ),БЛАГОВIЩЕНСЬКИЙ РАЙОН,1120
data_ti_sprsti_363,11,21,НОВОУКРАЇНСЬКА ОДПI ГУ ДФС (УСТИНIВСЬКЕ ВIДДIЛЕННЯ),УСТИНIВСЬКИЙ РАЙОН,1121
data_ti_sprsti_364,11,22,ОЛЕКСАНДРIЙСЬКА ОДПI ГУ ДФС (ЗНАМ'ЯНСЬКЕ ВIДДIЛЕННЯ),М.ЗНАМ'ЯНКА,1122
data_ti_sprsti_365,11,23,КРОПИВНИЦЬКА ОДПI ГУ ДФС У КIРОВОГРАДСЬКIЙ ОБЛАСТI,М.КРОПИВНИЦЬКИЙ,1123
data_ti_sprsti_366,11,24,ДПI В ЛЕНIНСЬКОМУ Р-НI М.КIРОВОГРАД,М.КIРОВОГРАД,0
data_ti_sprsti_367,11,25,ДПI В КIРОВСЬКОМУ Р-НI М.КIРОВОГРАД,М.КIРОВОГРАД,0
data_ti_sprsti_368,11,26,ОЛЕКСАНДРIЙСЬКА ОДПI ГУ ДФС У КIРОВОГРАДСЬКIЙ ОБЛАСТI,М.ОЛЕКСАНДРIЯ,1126
data_ti_sprsti_369,11,27,ОЛЕКСАНДРIЙСЬКА ОДПI ГУ ДФС (СВIТЛОВОДСЬКЕ ВIДДIЛЕННЯ),М.СВIТЛОВОДСЬК,1127
